,calle,barrio,municipio,tipo_vivienda,titulo,habitaciones,metros_cuadrados,aseos,planta,descripcion,etiquetas,garaje,precio
292,Chalet en calle Vicent Guzmán,Chalet en calle Vicent Guzmán,Aldaia,,"Chalet en calle Vicent Guzmán, Aldaia",3,98,,,"¡Preciosa casa completa con gran corral de 120m² en el centro de Aldaya!  
Ubicada en una de las zonas más demandadas de Aldaia, en la Brillantina, calle Vicente Guzmán, zona tranquila pero excelentemente comunicada que te permite disfrutar de lo mejor de ambos mundos: la serenidad del entorno y la proximidad a todos",[],No,309000
293,Piso en El Alborgí,Piso en El Alborgí,Paterna,Piso,"Piso en El Alborgí, Paterna",4,285,,Planta 2ª exterior sin ascensor,"GRAN VIVIENDA DE 200m2 CON TERRAZA DE 85m2 Y PLAZA DE GARAJE INCLUIDA EN EL PRECIO.
Vivienda de estilo señorial con toque andaluz, ubicada en una finca exclusiva con solo un vecino.  
En la planta baja encontramos la plaza de garaje (posibilidad de más plazas con coste extra)
En la segunda planta está ubicada nuestra",[],Sí,320000
294,Casa o chalet independiente en La Cañada,Casa o chalet independiente en La Cañada,Paterna,Chalet,"Casa o chalet independiente en La Cañada, Paterna",4,242,,,"Esta es una oportunidad excepcional para vivir en una casa espectacular rodeada de naturaleza y tranquilidad.
Esta propiedad independiente, con una parcela de 500 metros cuadrados, se encuentra en la mejor zona de La Cañada.
Al entrar a la propiedad, tienes la entrada a la vivienda y una bajada al garaje/sótano.
Una",['Villa'],Sí,510000
295,Chalet adosado,en Aldaia,Manises,Chalet,Chalet adosado en Aldaia,5,357,,,"EN PLENO CENTRO DE ALDAIA
Espectacular casa de pueblo en una de las mejores zonas de Aldaia y dispone de 375m2 organizada en dos plantas.
En la planta baja encontramos un enorme garaje para seis vehículos, un amplio trastero para el desahogo de tu día a día, una terraza espaciosa con el paellero para disfrutar todo e",[],Sí,395000
296,Casa o chalet independiente en La Cañada,Casa o chalet independiente en La Cañada,Paterna,Chalet,"Casa o chalet independiente en La Cañada, Paterna",7,311,,,"TODO UN LUJO CON INTIMIDAD
Situada en la zona de La Vallesa, hará que te enamores nada más cruzar el umbral de su puerta. Llena de luz y con unas calidades dignas de un palacio; suelos de mármol, ascensor y domótica en toda la vivienda. Distribuida en diferentes espacios bien diferenciados para mayor comodidad de tu f","['Lujo', 'Villa']",Sí,1600000
297,Casa o chalet independiente en La Cañada,Casa o chalet independiente en La Cañada,Paterna,Chalet,"Casa o chalet independiente en La Cañada, Paterna",3,333,,,"INDEPENDIENTE CON EXCELENTE UBICACIÓN.
Sus grandes cristales y sus espacios abiertos y conectados hacen que esta maravilosa vivienda cumpla los requisitos para la vida moderna familiar.
Con espacios privativos y coordinados a la perfección. Sorprende sus detalles como la puerta de entrada revestida de madera y sus gr",['Villa'],Sí,790000
298,Casa o chalet independiente en La Cañada,Casa o chalet independiente en La Cañada,Paterna,Chalet,"Casa o chalet independiente en La Cañada, Paterna",5,379,,,"UNA VIVIENDA CON MUCHA SOLERA
Presentamos una vivienda con solera en una de las mejores zonas residenciales, La Cañada (Paterna) en la tranquila urbanización de Entrecruces, cerca de todos los servicios como estación de metro, autobús, farmacias, restaurantes, colegios y supermercados.
La vivienda dispone de una par",['Villa'],Sí,1200000
299,Piso en calle Virgen Olivar,Piso en calle Virgen Olivar,Riba-Roja de Túria,Piso,"Piso en calle Virgen Olivar, Riba-Roja de Túria",4,141,,Planta 1ª exterior sin ascensor,"Presentamos una magnífica propiedad en Ribarroja del Turia COMPLETAMENTE REFORMADA, situada en un PRIMER PISO SIN ASCENSOR. Con un diseño moderno y acogedor, esta vivienda es una oportunidad única para quienes buscan un hogar con ESTILO, CONFORT y CALIDAD. Se encuentra en la tranquila calle Virgen del Olivar, con una p",[],No,215000
300,Ático en calle Doctor Cortés,Ático en calle Doctor Cortés,Aldaia,,"Ático en calle Doctor Cortés, Aldaia",3,112,,Planta 2ª con ascensor,"Esta encantadora vivienda situada en el barrio del Cristo, de dos plantas te ofrece todo lo que necesitas para disfrutar de una vida tranquila y cómoda. Imagina despertar en una de las tres amplias habitaciones, cada una con su propio armario empotrado, y disfrutar de un baño completo diseñado para tu máximo confort. E",[],No,190000
301,Casa o chalet independiente en La Cañada,Casa o chalet independiente en La Cañada,Paterna,Chalet,"Casa o chalet independiente en La Cañada, Paterna",5,454,,,"CON GRAN PARCELA DE 1.547m2.
La casa principal consta de 286m2 distribuidos en una planta con forma de L donde la piscina y sus jardines naturales cobran una papel esencial.
La vivienda disfruta de un salón super luminoso, familiar, dotado de gran altura con vigas de madera y acceso al exterior, otro salón-comedor pa",['Villa'],Sí,1100000
303,Casa o chalet independiente en La Cañada,Casa o chalet independiente en La Cañada,Paterna,Chalet,"Casa o chalet independiente en La Cañada, Paterna",5,291,3.0,,"Coldwell Banker Excellence, pone a la venta este chalet en La Cañada, Paterna. De 291m2 y 500m2 de parcela, 5 dormitorios, 3 baños, amplio garaje y trastero. Zona ajardinada y terraza exterior. Con aire acondicionado y calefacción.
Hablamos español, we speak english, nous parlons français. Llámanos y concertamos
una",[],Sí,595000
304,Chalet pareado en La Cañada,Chalet pareado en La Cañada,Paterna,,"Chalet pareado en La Cañada, Paterna",1,81,,,"Vive en una de las mejores zonas de Valencia en un Chalet Pareado en LA CAÑADA! Tempocasa vende en EXCLUSIVA en una ubicación privilegiada situada a 10 minutos andando del corazón de La Cañada, con la cercanía al centro la plaza y el metro, para disfrutar de una zona muy tranquila y de aire puro, además, que la propied",[],Sí,200000
305,Casa o chalet independiente en La Presa - Collado - La Malla,Casa o chalet independiente en La Presa - Collado - La Malla,Manises,Chalet,"Casa o chalet independiente en La Presa - Collado - La Malla, Manises",3,236,,,"Te gustaría vivir en plena Naturaleza a solo 15 minutos de Valencia, se vende estupenda casa con terreno en la urbanización La Presa (Manises).
La casa tiene dos plantas más terraza y se distribuye de la siguiente forma;
Planta Primera de 118 m2.
Salón comedor con chimenea, 3 habitaciones amplias y exteriores, baño c",[],Sí,240000
306,Dúplex en calle de la Baixada del Riu,Centro Ciudad,Manises,,"Dúplex en calle de la Baixada del Riu, Centro Ciudad, Manises",4,140,,Planta 3ª exterior con ascensor,"ESPECTACULAR DÚPLEX CON GARAJE Y TRASTERO EN LA ZONA FAITANAR.
Ubicado en zona común con piscina.
140m2 construidos y 124m2 útiles. Todo exterior Con cuatro habitaciones, todas con armarios empotrados más una buhardilla de 30m2. Dos baños (uno incorporado en suite). Cocina independiente con galería. 20m2 de salón com",[],Sí,230000
307,Ático en calle Minglanilla,Ático en calle Minglanilla,Aldaia,,"Ático en calle Minglanilla, Aldaia",2,161,,Planta 3ª exterior con ascensor,"008MIN189. ÁTICO SEMINUEVO Y AMPLIO CON BONITA TERRAZA
Amplio y luminoso, cada rincón ha sido diseñado para ofrecer comodidad y estilo. La bonita terraza se convierte en tu propio oasis privado, perfecto para relajarte al final del día. Ático dúplex distribuido en planta baja que consta de 2 dormitorios (antes eran 3,",[],No,183500
308,Casa o chalet independiente en calle 8,La Cañada,Paterna,Chalet,"Casa o chalet independiente en calle 8, La Cañada, Paterna",4,250,,,"Si es tu sueño, ahora lo puedes hacer realidad.. . Vive en el centro de La Cañada, a 4 minutos de la Plaza, junto al metro y con todos los servicios de tu día a día al alcance de la mano.
Disfrutando de este maravilloso Chalet Independiente, esquinero a 3 calles, podrás hacer que tu vida sea unas constantes vacaciones",[],Sí,770000
309,Casa o chalet independiente en La Presa - Collado - La Malla,Casa o chalet independiente en La Presa - Collado - La Malla,Manises,Casa,"Casa o chalet independiente en La Presa - Collado - La Malla, Manises",3,88,,,"Athika presenta. Finca rustica con vivienda urbana en la Urb. La Malla a tan solo 10 minutos de la población, muy buena comunicación y acceso, con servicio de autobús interurbano diario y gratuito que pasa por la puerta de la parcela y reparto de gas butano semanal a domicilio. 15.700m de terreno en plena producción de",[],No,495000
310,Casa o chalet independiente en La Cañada,Casa o chalet independiente en La Cañada,Paterna,Chalet,"Casa o chalet independiente en La Cañada, Paterna",5,291,,,"¡Descubre tu hogar ideal en El Plantío! Este impresionante chalet independiente de 291 m² construidos y 210 m² útiles te espera para entrar a vivir. Distribuido en dos plantas y un semisótano, esta vivienda destaca por su luminosidad y comodidad en cada rincón. En la planta principal, encontrarás un acogedor recibidor,",[],Sí,595000
311,Casa o chalet independiente en La Cañada,Casa o chalet independiente en La Cañada,Paterna,Chalet,"Casa o chalet independiente en La Cañada, Paterna",3,160,,,"oportunidad excepcional para vivir en una casa espectacular rodeada de naturaleza y tranquilidad. Esta propiedad independiente, con una parcela de 515 metros cuadrados, se encuentra en la mejor zona de La Cañada. Lo que hace que esta casa sea aún más especial es su acceso directo a un hermoso bosque de pinos antiguos,",[],No,379000
312,Casa o chalet independiente en calle 232,La Cañada,Paterna,Chalet,"Casa o chalet independiente en calle 232, s/n, La Cañada, Paterna",5,281,,,"Imagina entrar por la puerta principal de este chalet y sentir la amplitud y luminosidad que te envuelve. A tu derecha, encontrarás un amplio salón-comedor dividido en dos ambientes, perfectos para relajarte o disfrutar de una velada con amigos. Desde aquí, podrás acceder directamente a la terraza trasera, donde te esp",['Villa'],Sí,555000
313,Piso en Centro Ciudad,Piso en Centro Ciudad,Paterna,Piso,"Piso en Centro Ciudad, Paterna",2,74,,Planta 3ª exterior con ascensor,"¡Te presentamos esta encantadora vivienda en el emblemático barrio de Campamento, en Paterna, a solo unos minutos de la vibrante Valencia capital!
Esta propiedad de 57m2 útiles, que ha sido adaptada para maximizar su espacio, cuenta actualmente con dos dormitorios, aunque originalmente tenía tres, lo que te ofrece la p",[],No,135000
314,Piso en Centro Ciudad,Piso en Centro Ciudad,Paterna,Piso,"Piso en Centro Ciudad, Paterna",3,73,,Planta 1ª sin ascensor,"Vivienda ubicada en la poblacion de Paterna, Valencia.
Municipio que dispone de todos los servicios básicos a su alcance, con oferta comercial y educativa como IES Henri Matisse, variedad de servicios de restauración y zonas verdes valoradas en las que poder realizar actividades al aire libre como el Parque central.",[],No,90000
315,Piso en calle Valencia,El Carmen,Manises,Piso,"Piso en calle Valencia, 43, El Carmen, Manises",4,120,,Planta 1ª exterior con ascensor,,[],No,150000
316,Piso en calle Ribarroja,Centro Ciudad,Manises,Piso,"Piso en calle Ribarroja, Centro Ciudad, Manises",2,59,,,"id: 194392 Deberá introducir este código para poder atenderle telefónicamente.
Piso de 68 m2 de superficie construida, ubicado en la tercera planta de un edificio residencial de 6 plantas sobre rasante sin ascensor.
NOTA: Inmueble sin posesión. La adquisición del inmueble publicitado en este anuncio se realizará direc",[],No,77000
317,Chalet adosado en calle del Barranc de Rubio,La Cañada,Paterna,Chalet,"Chalet adosado en calle del Barranc de Rubio, La Cañada, Paterna",3,110,2.0,,"Venta chalet pareado en la cañada, para entrar a vivir, totalmente reformado, 110m2 de casa, 330m2 de parcela, 3 habitaciones, 2 baños, garaje, salon comedor, cocina, buhardilla de 20m2 diafana, calefaccion electrica, aire acondicionado frio y calor, jardin, piscina, jacuzzi, trastero, lavadero, paellero, leñero, zona",[],Sí,298000
318,Casa o chalet independiente en Dr. Machí,Centro Ciudad,Paterna,Chalet,"Casa o chalet independiente en Dr. Machí, 30, Centro Ciudad, Paterna",4,120,,,,[],Sí,260000
319,Piso en Centro Ciudad,Piso en Centro Ciudad,Manises,Piso,"Piso en Centro Ciudad, Manises",4,120,,Planta 1ª exterior sin ascensor,"¡Descubre tu nuevo hogar en el corazón de Manises! Este impresionante piso exterior de 120 m² te ofrece un espacio lleno de luz y comodidad. Con cuatro amplios dormitorios, cada uno bañado por la luz natural, y un salón espacioso que invita a relajarse, este hogar es perfecto para familias que buscan amplitud y confort",[],No,146000
320,Finca rústica,en Aldaia,Manises,,Finca rústica en Aldaia,4,322,,,"Os presentamos esta casa de campo con terreno en la zona de Aldaia, a un paso de todos los servicios bancos, restaurantes, comercios, colegios, negocios, autobús. Se trata de una casa de campo muy luminosa y con muchísimas posibilidades y para reformarla a tu gusto. Tiene una parte del terreno que se puede destinar par",[],No,300000
321,Casa o chalet independiente en calle Sant Miquel,Casa o chalet independiente en calle Sant Miquel,Aldaia,Chalet,"Casa o chalet independiente en calle Sant Miquel, Aldaia",11,550,,,"Casa independiente para derribar Situada en calle céntrica de Aldaia con una superficie de 385 m2 y 16 metros de fachada aproximada. posibilidad de segregación. Una casa para rehabilitar, con carácter que puedes modelar a tu gusto ¿por qué no comprar una casa de segunda mano e impregnarla con la esencia y el estilo que",[],No,265000
322,Casa o chalet independiente en La Cañada,Casa o chalet independiente en La Cañada,Paterna,Casa,"Casa o chalet independiente en La Cañada, Paterna",3,85,,,"Chalet en venta en la localidad de La Cañada, cercana a la población, al transporte público y a la zona comercial, con buenos accesos por carretera. La vivienda consta de dos plantas. La planta baja cuenta con salón-comedor, cocina, dos dormitorios, y un baño. La segunda planta es una buhardilla con un dormitorio y un",[],No,295000
323,Piso,en Aldaia,Manises,Piso,Piso en Aldaia,3,136,,Planta 4ª exterior con ascensor,"-NEEM-
Vivienda ubicada en el Barrio del Cristo, totalmente exterior en finca con ascensor del año 2007. Consta de 3 dormitorios, dormitorio principal con baño en suite, dos habitaciones dobles, salón exterior de 20m2 con acceso a balcón, cocina totalmente equipada con acceso a galería y baño con plato de ducha. Plaza",[],Sí,167500
324,Piso en calle Sant Salvador,Centro Ciudad,Paterna,Piso,"Piso en calle Sant Salvador, Centro Ciudad, Paterna",3,120,1.0,Planta 3ª exterior con ascensor,"EN VENTA, piso en centro paterna totalmente reformado, dispone de 3 dormitorios y 1 baño con posibilidad de hacer uno mas, salón comedor con salida a balcón, cocina office suelo tarima, carpintería exterior de climalit, balcón, carpintería interior lacada blanco.",[],No,210000
325,Piso en San Blas,Centro Ciudad,Paterna,Piso,"Piso en San Blas, Centro Ciudad, Paterna",3,95,,,"Venta de vivienda en planta baja, ubicada en la C/ San Blas, en el Centro de Paterna, zona con todos los servicios. Población muy próxima a Valencia, con muy buenas conexiones de transporte.
Inmueble exterior de 90 m2, 3 habitaciones amplias, comedor, baño completo, cocina y terraza de 18 m2.
Edificio con ascensor.",[],No,125000
326,Casa o chalet independiente en La Cañada,Casa o chalet independiente en La Cañada,Paterna,Chalet,"Casa o chalet independiente en La Cañada, Paterna",6,310,,,"Precioso chalet independiente de 310 metros cuadrados construidos sobre una parcela de 900 metros cuadrados, con innumerables rincones para disfrutar todo el año, con piscina, jardín y terrazas.
En planta sótano tenemos espacio para vehículos y estancia para bodega y taller. En la planta principal disponemos de 3 habi",[],Sí,450000
327,Casa o chalet independiente en calle de la Companyia,Centro Ciudad,Manises,Casa,"Casa o chalet independiente en calle de la Companyia, Centro Ciudad, Manises",2,97,,,"¡Gran oportunidad de inversión! Se vende casa por tan solo 85.000 € para reformar y hacer a gusto del comprador. Esta propiedad se encuentra cerca de comercios, transporte público y colegios, lo que la convierte en una ubicación ideal para familias o inversores. No dejes pasar la oportunidad de adquirir esta casa y con",[],Sí,85000
328,Estudio en Virgen De Belen,Centro Ciudad,Paterna,,"Estudio en Virgen De Belen, 13, Centro Ciudad, Paterna",74,74,,Planta 1ª exterior sin ascensor,"Vivienda situada en paterna, bien ubicada, cerca de todos los servicios.
Oferta wow.
Sin comision de agencia inmobiliaria.",[],No,90000
329,Ático en Santa Rita,Ático en Santa Rita,Paterna,,"Ático en Santa Rita, Paterna",1,65,,Planta 3ª exterior con ascensor,"Este encantador ático de 65 m², situado en la zona de Santa Rita-Alborgí en Paterna, se encuentra en la tercera planta de un edificio con ascensor. Con una habitación individual, un baño, cocina, comedor y una acogedora terraza, ofrece un espacio acogedor y luminoso. Además, cuenta con aire acondicionado, calefacción i",[],Sí,139000
330,Casa o chalet independiente en La Presa - Collado - La Malla,Casa o chalet independiente en La Presa - Collado - La Malla,Manises,Chalet,"Casa o chalet independiente en La Presa - Collado - La Malla, Manises",5,280,,,"CASA O CHALET EN VENTA EN CALLE CONCHETA, ALAMEDA PARK
J. A. F. Inmobiliaria dispone en Exclusiva de éste Chalet en la Urbanización La Presa.
Tiene una parcela Amplia y el Chalet está Para Entrar a Vivir.
La urbanización dispone de parada de Metro de la linea 9.
A 3 Minutos en coche del Aeropuerto de Manises.
A 5 minu",[],Sí,273000
331,Chalet en Santa Rita,Chalet en Santa Rita,Paterna,Chalet,"Chalet en Santa Rita, Paterna",2,189,,,"Casa Cueva en venta en Paterna. Se caracteriza por su superficie total de 189 m², distribuidos en una superficie solar de 156 m² y una superficie útil de 189 m². Con una habitación individual, una habitación doble y un aseo, esta propiedad es del año 1935 se encuentra en estado a reformar y además cuenta con toda la pa",[],No,120000
332,Piso en calle Lope de Vega,Piso en calle Lope de Vega,Quart de Poblet,Piso,"Piso en calle Lope de Vega, Quart de Poblet",3,161,,Planta 1ª sin ascensor,Piso en Quart de Poblet. Cuenta con una superfície de 96 m2.,[],No,124000
333,Piso en Quart,de Poblet,Manises,Piso,Piso en Quart de Poblet,2,69,,Planta 5ª exterior sin ascensor,"Para Inversores. Vivienda situada en 5º planta sin ascensor, compuesta por 2 habitaciones antes 3, cuarto de baño reformado con plato de ducha y salón con amplio balcón a la calle y cocina.
La vivienda dispone de suelo de gres en tono marrón clarito, ventanas de aluminio, puertas interiores de sapelli, aire acondiciona",[],No,86000
334,Casa o chalet independiente en Centro Ciudad,Casa o chalet independiente en Centro Ciudad,Manises,Chalet,"Casa o chalet independiente en Centro Ciudad, Manises",4,294,,,"PISO + LOCAL, TODO ESQUINERO.
VEN A VERLO y veras todas las posibilidades que tiene.
Tiene todo lo que necesitas, luz natural durante todo el día 4 grandes habitaciones y una terraza que sales desde la cocina y llegas al paellero de unos 20m2.
Arriba tenemos una terraza de todo lo que es la vivienda.
En el local podr",[],No,410000
335,Piso en Centro Ciudad,Piso en Centro Ciudad,Paterna,Piso,"Piso en Centro Ciudad, Paterna",3,94,,Planta 1ª exterior con ascensor,"Venta de piso céntrico reformado en excelente condición.
Características principales: piso completamente reformado y listo para entrar a vivir. Plaza de garaje incluida para mayor comodidad, trastero amplio para almacenamiento adicional, electrodomésticos incluidos. Todo en excelente estado.
Con una ubicación inmejora",[],Sí,240000
336,Casa o chalet independiente en calle García Lorca,Centro Ciudad,Manises,Chalet,"Casa o chalet independiente en calle García Lorca, Centro Ciudad, Manises",1,190,,,"PRECIO NEGOCIABLE
ACTUALMENTE TAPIADA PARA QUE NO ENTRE NADIE
Se vende casa de pueblo, está para reformar completamente, la vivienda está tapiada. Vivienda muy bien ubicada, con 12 metros de fachada y posibilidad de edificar bajo más dos alturas. Se vende como solar. Ubicada al lado de la parada del metro de Manises, m",[],No,195000
337,Piso en Centro Ciudad,Piso en Centro Ciudad,Paterna,Piso,"Piso en Centro Ciudad, Paterna",2,58,,Planta 3ª interior sin ascensor,"TOTALMENTE REFORMADO A ERSTRENAR
OPORTUNIDAD UNICA EN NATZARET 
ACABADOS A TU GUSTO
Descubre tu nuevo hogar en este encantador y acogedor piso de 58 m², una joya que combina funcionalidad, estilo y confort. Ideal para aquellos que buscan un espacio moderno y práctico sin renunciar a la comodidad.
Características princ",[],No,160000
338,Piso en calle García Lorca,Centro Ciudad,Manises,Piso,"Piso en calle García Lorca, 1, Centro Ciudad, Manises",2,70,,Planta 4ª exterior sin ascensor,"Piso en 4º planta sin ascensor de 70 metros. La vivienda se distribuye en 2 amplias habitaciones y un baño, espacioso y amplio salón con dos balcones y cocina completamente equipada.
Además la vivienda cuenta con dos split de aire acondicionado frio/calor y un trastero en la terraza de la finca. Junto a la parada de m",[],No,119000
339,Piso en calle Major,Centro Ciudad,Paterna,Piso,"Piso en calle Major, 30, Centro Ciudad, Paterna",2,75,1.0,Planta 5ª exterior sin ascensor,"Se vende apartamento cuco céntrico semi-reformado y semi-amueblado en calle peatonal de PATERNA, (Valencia)centro de salud a 5 mín andando, bancos, supermercados, tiendas, Ayuntamiento etc. El piso cuenta con 2 habitaciones, 1 baño, terraza y cocina muy amplia, todo exterior e iluminado, vistas a las montañas, con tras",[],No,230000
340,Casa o chalet independiente en calle del Rossinyol,La Presa - Collado - La Malla,Manises,Chalet,"Casa o chalet independiente en calle del Rossinyol, 1, La Presa - Collado - La Malla, Manises",4,145,,,"Chalet independiente, de 136 m2 en 2 plantas, 4 habitaciones, 1 aseo y dos cuartos de baño. Parcela de 1100metros con paellero, y piscina y depuradora, y trastero. Es terreno urbanizable. De particular a particular no inmobiliarias.",[],Sí,370000
341,Estudio en calle de los molinos,Centro Ciudad,Paterna,,"Estudio en calle de los molinos, 22, Centro Ciudad, Paterna",67,67,,,"Se vende bajo en una de las mejores zonas de Paterna, en el centro de la población, cerca de colegios, supermercados, parada del metro y todo tipo de comercios a su alrededor.
Actualmente esta como garaje y dado la moratoria del ayuntamiento no se puede hacer el cambio de uso a vivienda hasta julio 2025.",[],No,60000
342,Cortijo en calle Major,58,Aldaia,,"Cortijo en calle Major, 58, Aldaia",4,650,,,Cortijo Valenciano/Aqueria tradicional con amplio patio y casa señorial en Calle Mayor de Aldaia. Vistas a tres calles. A unos 5 minutos en coche de Bonaire y a pocos metros del centro de la ciudad.,['Cortijo'],Sí,288000
344,Piso en calle de les Roses,Poligono del Aeropuerto,Manises,Piso,"Piso en calle de les Roses, 20, Poligono del Aeropuerto, Manises",2,97,,,"En Rosas20 te ofrecemos una estupenda oportunidad de mejorar tu calidad de vida disfrutando de un entorno armonioso, agradable y muy bien situado.
Viviendas de 1, 2 y 3 dormitorios, plazas de garaje y trasteros que cuentan con una cuidada distribución con amplias y luminosas estancias, pensadas para cubrir las necesida",[],No,220000
345,Piso en calle dels Pins,Parc Central,Paterna,Piso,"Piso en calle dels Pins, 5, Parc Central, Paterna",3,107,,Planta 4ª exterior con ascensor,"Único Homes lanza Llara Paterna; una fantástica Promoción de obra nueva en Paterna de 52 viviendas, de 2 y 3 dormitorios, con amplias y luminosas terrazas, semi-áticos o áticos. Piscina y solarium en la azotea. Parking de bicicletas. Garaje y trastero no incluido en el precio.
Situada en una de las avenidas principa",[],No,223000
346,Piso en calle dels Pins,Parc Central,Paterna,Piso,"Piso en calle dels Pins, 5, Parc Central, Paterna",2,98,,Planta 1ª exterior con ascensor,"Único Homes lanza Llara Paterna; una fantástica Promoción de obra nueva en Paterna de 52 viviendas, de 2 y 3 dormitorios, con amplias y luminosas terrazas, semi-áticos o áticos. Piscina y solarium en la azotea. Parking de bicicletas. Garaje y trastero no incluido en el precio.
Situada en una de las avenidas principa",[],No,195000
347,Piso en calle dels Pins,Parc Central,Paterna,Piso,"Piso en calle dels Pins, 5, Parc Central, Paterna",3,106,,Planta 1ª exterior con ascensor,"Único Homes lanza Llara Paterna; una fantástica Promoción de obra nueva en Paterna de 52 viviendas, de 2 y 3 dormitorios, con amplias y luminosas terrazas, semi-áticos o áticos. Piscina y solarium en la azotea. Parking de bicicletas. Garaje y trastero no incluido en el precio.
Situada en una de las avenidas principa",[],No,220000
348,Piso en calle de les Roses,Poligono del Aeropuerto,Manises,Piso,"Piso en calle de les Roses, 20, Poligono del Aeropuerto, Manises",3,114,,Planta 1ª exterior con ascensor,"Licencia de obras concedida. Próximo comienzo de obras.
AQUÍ SE ENCUENTRA TU NUEVO HOGAR!.. . En Rosas20 te ofrecemos una estupenda oportunidad de mejorar tu calidad de vida disfrutando de un entorno armonioso, agradable y muy bien situado.
Viviendas amplias y luminosas, de 1, 2 y 3 dormitorios, que cuentan con una cu",[],No,230000
